{"corpusRevision":"khronos-2026-08-19-v1","coverageClaims":[{"claimId":"lantern-color-texture","evidence":{"semantic":"color","size":[2048,2048]},"packageId":"khronos-lantern-glb","subject":"texture:base-color"},{"claimId":"lantern-data-texture","evidence":{"semantic":"data","size":[2048,2048]},"packageId":"khronos-lantern-glb","subject":"texture:metallic-roughness"},{"claimId":"lantern-embedded-dependencies","evidence":{"images":4,"storage":"bufferView"},"packageId":"khronos-lantern-glb","subject":"Lantern.glb"},{"claimId":"lantern-indexed-triangles","evidence":{"indexed":true,"primitiveCount":3},"packageId":"khronos-lantern-glb","subject":"mesh:*"},{"claimId":"lantern-local-hierarchy","evidence":{"nodeCount":4},"packageId":"khronos-lantern-glb","subject":"scene:0"},{"claimId":"lantern-multiple-primitives","evidence":{"primitiveCount":3},"packageId":"khronos-lantern-glb","subject":"mesh:*"},{"claimId":"lantern-normal-texture","evidence":{"semantic":"normal","size":[2048,2048]},"packageId":"khronos-lantern-glb","subject":"texture:normal"},{"claimId":"lantern-rgb-source","evidence":{"channels":3,"count":3},"packageId":"khronos-lantern-glb","subject":"images:1-3"},{"claimId":"lantern-rgba-source","evidence":{"channels":4,"count":1},"packageId":"khronos-lantern-glb","subject":"image:0"},{"claimId":"lantern-texture-2k","evidence":{"count":4,"size":[2048,2048]},"packageId":"khronos-lantern-glb","subject":"images:*"},{"claimId":"sponza-color-texture","evidence":{"semantic":"color"},"packageId":"khronos-sponza-gltf","subject":"materials:*"},{"claimId":"sponza-data-texture","evidence":{"semantic":"data"},"packageId":"khronos-sponza-gltf","subject":"materials:*"},{"claimId":"sponza-external-dependencies","evidence":{"buffers":1,"images":69,"storage":"external"},"packageId":"khronos-sponza-gltf","subject":"Sponza.gltf"},{"claimId":"sponza-indexed-triangles","evidence":{"indexed":true,"primitiveCount":103},"packageId":"khronos-sponza-gltf","subject":"mesh:0"},{"claimId":"sponza-multiple-materials","evidence":{"materialCount":25},"packageId":"khronos-sponza-gltf","subject":"materials:*"},{"claimId":"sponza-multiple-primitives","evidence":{"primitiveCount":103},"packageId":"khronos-sponza-gltf","subject":"mesh:0"},{"claimId":"sponza-normal-texture","evidence":{"semantic":"normal"},"packageId":"khronos-sponza-gltf","subject":"materials:*"},{"claimId":"sponza-rgb-source","evidence":{"channels":3,"count":66},"packageId":"khronos-sponza-gltf","subject":"images:*"},{"claimId":"sponza-rgba-source","evidence":{"channels":4,"count":3},"packageId":"khronos-sponza-gltf","subject":"images:*"},{"claimId":"sponza-shared-dependency","evidence":{"maximumReferences":3,"sharedTextureCount":2},"packageId":"khronos-sponza-gltf","subject":"textures:*"},{"claimId":"sponza-texture-1k","evidence":{"count":68,"size":[1024,1024]},"packageId":"khronos-sponza-gltf","subject":"images:*"}],"packages":[{"acquiredOn":"2026-08-22","coverageClaims":["lantern-color-texture","lantern-data-texture","lantern-embedded-dependencies","lantern-indexed-triangles","lantern-local-hierarchy","lantern-multiple-primitives","lantern-normal-texture","lantern-rgb-source","lantern-rgba-source","lantern-texture-2k"],"files":[{"path":"Lantern.glb","role":"model","sha256":"a79458c4b02d695187a952f23a63b8bf278e7bc3d316a3c2a314f2d6974181f1","sizeBytes":9564264},{"path":"README.md","role":"other-source","sha256":"05b828c6032d8f3681ce0ba92bbd6068291fe0a37965f967eb8aab8091ed4143","sizeBytes":451}],"packageId":"khronos-lantern-glb","packageName":"glTF-Binary","packageRoot":"Regular/Lantern","publisher":"KhronosGroup glTF Sample Assets","revision":"bf2bb4a81c73a7ceb53e80df3dec0105c5a3fdef","rootAssetId":"StaticModel:Lantern.glb#idx.scene.0","rootFile":"Lantern.glb","sourceLocation":"https://github.com/KhronosGroup/glTF-Sample-Assets","sourcePath":"Models/Lantern/glTF-Binary","tier":"regular","workName":"Lantern"},{"acquiredOn":"2026-08-22","coverageClaims":["sponza-color-texture","sponza-data-texture","sponza-external-dependencies","sponza-indexed-triangles","sponza-multiple-materials","sponza-multiple-primitives","sponza-normal-texture","sponza-rgb-source","sponza-rgba-source","sponza-shared-dependency","sponza-texture-1k"],"files":[{"path":"10381718147657362067.jpg","role":"image","sha256":"c119be5aae2419a8120fd17691033ca28e0b5546cef7e31d40f6dec1543affee","sizeBytes":881980},{"path":"10388182081421875623.jpg","role":"image","sha256":"c915c9cc8be8f198ab1cc3bc68c2f6c694b88432f381a8f27935d480141ae8f5","sizeBytes":917202},{"path":"11474523244911310074.jpg","role":"image","sha256":"23c32277c33d8eac091cd73daf81561ebe3640eede49b037546ed5c244a01347","sizeBytes":1079152},{"path":"11490520546946913238.jpg","role":"image","sha256":"98e4c4a091fea684cd693f3ae7ebe83e491969b501b4cd6e1fdd6a3cc1fa5cab","sizeBytes":321375},{"path":"11872827283454512094.jpg","role":"image","sha256":"da2a0b308b4d6d57ffbcf4bb7509d4afe91156d5d86d0396e83d7cac883a4857","sizeBytes":668962},{"path":"11968150294050148237.jpg","role":"image","sha256":"bee42826d56d3ff719c4908c11ef65584fbe19e08273862fde7ec1408e44ba25","sizeBytes":530384},{"path":"1219024358953944284.jpg","role":"image","sha256":"9cbd61fcb8047f1c21450eff05207b29d71824edd75483267b5fbc2f7b21378c","sizeBytes":329124},{"path":"12501374198249454378.jpg","role":"image","sha256":"fe640b8875c8ff04f4ec427274d2e799b703cff384b9c2dafef63b61d05f34fa","sizeBytes":418235},{"path":"13196865903111448057.jpg","role":"image","sha256":"8c26ae9523cfae7a062fd074f74e0ddbb61630772f9a2130489e1d6e4724c38b","sizeBytes":281980},{"path":"13824894030729245199.jpg","role":"image","sha256":"9158388312a76ba25a40d3b57978e1ace224882e53198a766494d98f9118aeba","sizeBytes":313460},{"path":"13982482287905699490.jpg","role":"image","sha256":"b91209e6ede0b905565bd719d6e27533abc7a5930d031a454f9aae65771fc4b0","sizeBytes":347538},{"path":"14118779221266351425.jpg","role":"image","sha256":"994ba4e063564d75350ceec1381347a620baef75f9ca689e28718a88c3e3bd88","sizeBytes":1611314},{"path":"14170708867020035030.jpg","role":"image","sha256":"55cbda42c13377a71cb8ee78406309e888f56bc85af9473ca84a6097f2252166","sizeBytes":140738},{"path":"14267839433702832875.jpg","role":"image","sha256":"d14f693c5cf7d1e506865488fdb68daadd42bbdcb0c534e2f96ccfd747e46a60","sizeBytes":711217},{"path":"14650633544276105767.jpg","role":"image","sha256":"e8b68080eb4c5709536dfb7858d595d51d4bb725003e11b0f383acf76a7e05a3","sizeBytes":521947},{"path":"15295713303328085182.jpg","role":"image","sha256":"5bbd0cbf2da7416d5620514ebb0c4837b0ccc841b649cf4070281aa333ff8520","sizeBytes":520162},{"path":"15722799267630235092.jpg","role":"image","sha256":"8511ada3c77ed171a21d58362d996b20cfa6c632fe4c95c3a8614e410e623a31","sizeBytes":560258},{"path":"16275776544635328252.png","role":"image","sha256":"d6df943a0dcf535d9dfb009c2833e0c7dc21939cfe3a2c10316c552b3dc3441b","sizeBytes":1077432},{"path":"16299174074766089871.jpg","role":"image","sha256":"21d5f7ab6a7d05200b76165771fb3c5f14d006236a9dd27fff9eb92b69de4fa6","sizeBytes":322693},{"path":"16885566240357350108.jpg","role":"image","sha256":"5562f0e76ca213d72295e48b8a14a59ee1971f58a47f95e5c022a4e78371c5aa","sizeBytes":12575},{"path":"17556969131407844942.jpg","role":"image","sha256":"cb09708202859d08764601acc9c9ea3b5254b2c4fd39dcc6b6055768c77aee9b","sizeBytes":370061},{"path":"17876391417123941155.jpg","role":"image","sha256":"005b774a968c1f6af00e4bf97afd668a6a045126a94f524df722ba19edc77d61","sizeBytes":1151448},{"path":"2051777328469649772.jpg","role":"image","sha256":"0f25b73991003300bd5e2c8fcbc46ec4e2788a8deb42321f575d5187aee21b85","sizeBytes":206618},{"path":"2185409758123873465.jpg","role":"image","sha256":"88861c8c7f10517c1d7942f316aae3b74dc5b8ae2faa2021d9dfe9d2c09fb24f","sizeBytes":780166},{"path":"2299742237651021498.jpg","role":"image","sha256":"da92fd0303571290c36b0f655f357fda77015b788613c65b18346480e1bd8324","sizeBytes":772672},{"path":"2374361008830720677.jpg","role":"image","sha256":"782c48410db52360083719a48f8d15d29aa5cd4beeb817f1fd195083b2feb60a","sizeBytes":852079},{"path":"2411100444841994089.jpg","role":"image","sha256":"12e1f2ea3c2714a6ec455fa8e623a702e33ef95765ebd09f7874a68fa55fd104","sizeBytes":399963},{"path":"2775690330959970771.jpg","role":"image","sha256":"751606c94a5fe5bda3bf6709e7f6a74363bd7902bf2353d54e55ef3b50007487","sizeBytes":785678},{"path":"2969916736137545357.jpg","role":"image","sha256":"dfa17f2dee2cd2d850585673d19d5cda477a63e21659b346d8730e80edd3b347","sizeBytes":822373},{"path":"332936164838540657.jpg","role":"image","sha256":"782c48410db52360083719a48f8d15d29aa5cd4beeb817f1fd195083b2feb60a","sizeBytes":852079},{"path":"3371964815757888145.jpg","role":"image","sha256":"d939d2e8bf11c2cf375154129f861b982c786b83db79cb9fde1a2b94b46caf62","sizeBytes":682743},{"path":"3455394979645218238.jpg","role":"image","sha256":"967005ccfbf4d38f674df41aebb3e58ac1fdcd91f554ead7acfcc132372f8ec6","sizeBytes":551432},{"path":"3628158980083700836.jpg","role":"image","sha256":"5a05dc004bbff7e6f89cffab57ae4f4fe2cf04dfbd22b52ec85cf17bf92c8855","sizeBytes":527788},{"path":"3827035219084910048.jpg","role":"image","sha256":"1c2fc5ddaefc59763823f58d0450c00d114d89ab3d0ac395fd1316b664a8a56d","sizeBytes":608394},{"path":"4477655471536070370.jpg","role":"image","sha256":"f0592537da8edc8476d9903f4ab1839d1a7ab0efa2507d303e8720b57bedf848","sizeBytes":211322},{"path":"4601176305987539675.jpg","role":"image","sha256":"70eaa9efca842696271d2e4e04b1c77c087f8b5350d8d90940b800cc654b269a","sizeBytes":1043152},{"path":"466164707995436622.jpg","role":"image","sha256":"21bb124f5b5d4d5e9c8d9773cd31dedfc41b30eb302af36e7257cf930152908e","sizeBytes":486634},{"path":"4675343432951571524.jpg","role":"image","sha256":"9d5fd79619a52db0232edb2287f5f05c0124c304355e3b035a4e48c0871090bf","sizeBytes":764529},{"path":"4871783166746854860.jpg","role":"image","sha256":"259b6659cb2681e06ef04becd49298d379f2f25b2cc468acf0c2ade4d190637c","sizeBytes":570081},{"path":"4910669866631290573.jpg","role":"image","sha256":"70eaa9efca842696271d2e4e